{
  "schemaVersion": "1.0.0",
  "eventId": "018f6c2e-7b9a-7e2f-9a5d-abcdef012345",
  "tenantId": "11111111-1111-4111-8111-111111111111",
  "observedAt": "2026-09-16T21:10:00.000Z",
  "receivedAt": "2026-09-16T21:10:05.000Z",
  "source": {
    "type": "integration",
    "provider": "github",
    "collector": "github-activity",
    "version": "1.0.0"
  },
  "category": "repository",
  "action": "repository.pushed",
  "outcome": "success",
  "identity": {
    "type": "human",
    "provider": "github",
    "subject": "fixture-account-123"
  },
  "resource": {
    "type": "repository",
    "id": "fixture-repository-456",
    "provider": "github",
    "name": "example/repository"
  },
  "attributes": {
    "branch": "main",
    "commitCount": 2,
    "forced": false
  },
  "enrichment": {
    "labels": ["fixture", "github"]
  },
  "integrity": {
    "idempotencyKey": "fixture-github-repository-pushed"
  }
}
