{
  "schemaVersion": "1.0.0",
  "eventId": "018f6c2e-7b9a-7d1e-8f4c-123456789abc",
  "tenantId": "11111111-1111-4111-8111-111111111111",
  "observedAt": "2026-09-16T20:15:30.123Z",
  "receivedAt": "2026-09-16T20:15:31.456Z",
  "source": {
    "type": "endpoint",
    "provider": "windows",
    "collector": "balerx-sensor",
    "version": "0.0.0"
  },
  "category": "process",
  "action": "process.started",
  "outcome": "success",
  "device": {
    "id": "22222222-2222-4222-8222-222222222222",
    "hostname": "fixture-workstation",
    "platform": "windows",
    "osVersion": "fixture",
    "sensorVersion": "0.0.0"
  },
  "identity": {
    "type": "human",
    "provider": "windows",
    "subject": "fixture-user"
  },
  "process": {
    "pid": 4242,
    "parentPid": 2048,
    "executable": {
      "name": "example-agent.exe",
      "path": "C:\\Program Files\\Example\\example-agent.exe",
      "sha256": "aaaaaaaaaaaaaaaaaaaaaaaaaaaaaaaaaaaaaaaaaaaaaaaaaaaaaaaaaaaaaaaa",
      "publisher": "Example Vendor",
      "signed": true,
      "product": "Example Agent"
    },
    "userSubject": "fixture-user"
  },
  "agent": {
    "definitionId": "example-agent",
    "name": "Example Agent",
    "classification": "VERIFIED_SUPPORTED_AGENT"
  },
  "attributes": {
    "collectionMethod": "fixture",
    "sanitized": true
  },
  "integrity": {
    "idempotencyKey": "fixture-endpoint-process-started",
    "sequence": 1
  }
}
